machine_slug,machine_name,manufacturer,category,release_year,price_last_updated,motor_hp,voltage,blade_size,cut_capacity_height,cut_capacity_width,table_dimensions,weight_lbs,dust_port_diameter,tier,who_its_for,owner_praise,owner_limitations,upgrade_compatibility,affiliate_link_1,affiliate_retailer_1,affiliate_price_1,affiliate_link_2,affiliate_retailer_2,affiliate_price_2,affiliate_link_3,affiliate_retailer_3,affiliate_price_3,compare_1_slug,compare_1_note,compare_2_slug,compare_2_note,compare_3_slug,compare_3_note,status,date_published,notes
laguna-fusion-f2,"Laguna Fusion F2 Table Saw (1.75 HP, 36"" rip)",Laguna,Table Saw,2019,7/6/2026,1.75,110V,,,,,275,4,Semi-Pro,"The F2 Fusion is aimed at the home shop that cares about a clean workspace and easy mobility. Its enclosed base and above-blade guard pickup catch far more dust than an open contractor saw, and the casters are already built into the cabinet so you can roll it out of the way. It runs on a 110V circuit and suits furniture and cabinet work in a small to medium shop.",Dust collection is genuinely good with pickup above and below the blade | The mobility kit is built into the cabinet so you can roll it anywhere | The High/Low Euro fence flips for thin stock and pulls back for safer crosscuts | The cast-iron top and arbor adjustments feel smooth and precise,At 1.75 HP on 110V it is not built for heavy hardwood ripping | A 36 inch rip fence is a bit tight for full sheets | The fence and throat plate feel a step below the bigger F3 | Some owners wish it had more power for the price,"The saw accepts an 8-inch dado stack up to 3/4 inch using the Laguna Fusion dado insert, and it comes with the High/Low fence and rail already. Add a zero-clearance insert, connect a 4-inch hose to the main port and a small hose to the blade-guard port for near-dustless cutting, and drop in a better blade. The built-in casters mean no separate mobile base, and it is 110V only.",https://www.rockler.com/laguna-f2-fusion-1-75hp-table-saw-36-ripfence,Rockler,1999,,,,,,,jet-proshop-ii-jps-10,The Jet ProShop II is a similar 115V hybrid at a close price.,grizzly-g0962,The Grizzly G0962 is a cheaper hybrid with a 4-inch port.,sawstop-contractor-saw-cns,The SawStop CNS adds a flesh-sensing safety brake.,Live,,"New 7/6/2026. Price $1,999 VERIFIED on Rockler page (F2 Fusion, 36 in fence). 110V only. 1.75 HP."
sawstop-pcs-3hp-professional-cabinet-saw,"SawStop Professional Cabinet Saw 3HP (PCS31230-TGP236, 36"" T-Glide)",SawStop,Table Saw,2009,7/6/2026,3,240V,,,,,426,4,Professional,"This is the saw for woodworkers who want the safety brake and are willing to pay for it. It fits serious hobbyists and pros running a 240V shop who want a cabinet saw that arrives well tuned and stays accurate. If finger safety is high on your list, this is the obvious pick.",The skin-sensing brake works as promised and gives real peace of mind | Fence and blade alignment are quick to set and hold their tune | The T-Glide fence slides smoothly and locks square every time | Three horsepower rips hardwood without bogging down,"The overarm dust collection could be better and many owners rig up their own fix | The blade guards block your view of the cut | Saws can arrive slightly out of alignment after shipping | You pay to replace a brake cartridge if it fires, including on wet or metallic stock","Takes any standard 10-inch blade and an 8-inch dado stack up to 29/32 inch with the separate dado brake cartridge and insert. Works with SawStop overarm dust collection, integrated router tables, outfeed tables, and a mobile base, and the 36 inch rails can be swapped for a 52 inch setup.",https://www.sawstop.com/product/professional-cabinet-saw-pcs31230-tgp236/,SawStop,3881,,,,,,,sawstop-ics-3hp-industrial-cabinet-saw,The SawStop ICS is the heavier industrial version of the same safety saw.,powermatic-pm2000b-3hp-table-saw,The Powermatic PM2000B is a 3 HP cabinet saw without the safety brake.,sawstop-contractor-saw-cns,"The SawStop CNS is a lighter, cheaper contractor saw with the same brake.",Live,,"New 7/6/2026. Price $3,881 VERIFIED on sawstop.com (3 HP, 36 in T-Glide). 3 HP, 240V."
powermatic-pm2000b-3hp-table-saw,"Powermatic PM2000B 10"" Table Saw 3HP, 30"" Rip w/ Accu-Fence",Powermatic,Table Saw,2017,7/6/2026,3,240V,,,,,535,4,Professional,"This one is for the woodworker who wants a heavy, smooth-running cabinet saw with the Powermatic name and finish. It suits pros and dedicated hobbyists who value a rigid trunnion and buttery adjustments over the lowest price. The 30 inch rip fits a shop building furniture and cabinets that does not need full sheet-ripping width out of the box.","The one-piece cast-iron trunnion makes it rigid and almost vibration-free | Swapping the riving knife takes no tools, and a second low-profile knife comes in the box | The digital bevel readout and hydraulic caster base are handy upgrades on the B version | Three horsepower handles furniture-shop hardwood with room to spare","You only get a standard throat plate, and the factory dado and zero-clearance inserts are pricey | A few owners have dealt with shipping damage or slow-to-find small plastic parts | The price is high for a 3 HP saw when cheaper cousins perform close to it | The digital readout and hydraulic base add cost that not everyone feels they need","Runs any 10-inch blade and a dado stack with the matching Powermatic dado insert. The 30 inch Accu-Fence rails can be extended to a 50 inch setup, and the saw pairs with an overarm blade guard, better dust collection through the 4-inch port, and the built-in hydraulic mobility kit.",https://www.rockler.com/powermatic-pm2000b-table-saw-3hp-1-phase-230v-30-rip-accu-fence,Rockler,5092,,,,,,,jet-xactasaw-deluxe-3hp-cabinet-saw,The Jet XactaSaw Deluxe is a 3 HP cabinet saw from the same parent company for less.,sawstop-pcs-3hp-professional-cabinet-saw,The SawStop PCS adds a flesh-sensing brake at a similar price.,grizzly-g1023rl,The Grizzly G1023RL is a 3 HP cabinet saw at less than half the price.,Live,,"New 7/6/2026. Price $5,092 VERIFIED on Rockler page (item 68568). 3 HP, 240V. 45 depth is the widely cited figure (powermatic.com page returned empty)."
jet-xactasaw-deluxe-3hp-cabinet-saw,"Jet Deluxe XactaSaw 10"" Table Saw 3HP, 30"" Rip (JTAS-10XL30-DX)",Jet,Table Saw,2007,7/6/2026,3,240V,,,,,490,4,Professional,"The Deluxe XactaSaw fits the woodworker who wants a proven, well-finished cabinet saw and likes the Jet name and warranty. It works well for furniture and cabinet shops running 240V that want a saw arriving nearly tuned. Buyers who care about dealer support and a long track record tend to land here.","Owners say it shows up well aligned and cutting smoothly right away | The Xacta II fence is heavy and stays square once set | The shrouded blade and Poly-V belt pull dust down well | The modular guard and riving knife setup earns long-term loyalty, some past a decade","The trunnion is a notch below the Powermatic built by the same parent company | Older units shipped without a riving knife | The tilt lock can strip if you crank it too hard at a bevel | Next to a Grizzly, some owners feel the build alone does not explain the price gap","Accepts any 10-inch blade and an 8-inch dado stack up to 13/16 inch with the Jet dado insert. The 30 inch Xacta rails can be moved up to a 50 inch set, and Jet sells a universal mobile base, low-profile riving knives, and matching guard parts. The 4-inch port takes a shop dust collector directly.",https://www.rockler.com/jet-deluxe-xacta-3hp-10-table-saw-w-30-fence,Rockler,4014,,,,,,,powermatic-pm2000b-3hp-table-saw,The Powermatic PM2000B is the premium sister saw with a heavier trunnion.,grizzly-g1023rl,The Grizzly G1023RL is a 3 HP cabinet saw for far less money.,sawstop-pcs-3hp-professional-cabinet-saw,The SawStop PCS adds a flesh-sensing safety brake.,Live,,"New 7/6/2026. Price $4,014 VERIFIED on Rockler page (JTAS-10XL30-DX). 3 HP, 240V. 90 depth and tilt inferred as class standard (not on jettools spec table)."
sawstop-ics-3hp-industrial-cabinet-saw,"SawStop Industrial Cabinet Saw 3HP (ICS31230-TGI236, 36"" T-Glide)",SawStop,Table Saw,2009,7/6/2026,3,240V,,,,,635,4,Professional,"This is the heavy-duty SawStop for a busy shop or one that runs the saw hard all day. It suits pros, schools, and production settings that want the safety brake on a saw built like a tank. Home woodworkers who do not need that mass and duty cycle are usually better served by the PCS.","It is built like a tank, around 635 pounds, and runs quiet with almost no vibration | Factory fit and finish are excellent, with blade and miter slot dialed in tight | The dust-collection blade guard grabs nearly all the above-table dust | Three horsepower never runs short, and it tends to have fewer motor headaches than the 5HP","The included extension table feels flimsier than some owners expect | A few felt a recent unit did not fully live up to the industrial billing | The 5HP versions have known start-capacitor wear, which nudges buyers to the 3HP | It is heavy, big, and pricey, and overkill for most home shops next to the PCS","Runs any 10-inch blade and an 8-inch dado stack up to 29/32 inch with the dado brake cartridge and insert. Works with SawStop overarm dust collection, router tables, and outfeed tables, converts to a 52 inch rip with longer rails, and rolls on the SawStop industrial mobile base.",https://www.sawstop.com/product/industrial-cabinet-saw-ics31230-tgi236/,SawStop,5154,,,,,,,sawstop-pcs-3hp-professional-cabinet-saw,"The SawStop PCS is the lighter, cheaper cabinet saw with the same brake.",powermatic-pm2000b-3hp-table-saw,The Powermatic PM2000B is a premium 3 HP cabinet saw without the brake.,jet-xactasaw-deluxe-3hp-cabinet-saw,The Jet XactaSaw Deluxe is a 3 HP cabinet saw at a lower price.,Live,,"New 7/6/2026. Price $5,154 starting VERIFIED on sawstop.com (3 HP, 36 in T-Glide). 3 HP, 240V. Assembled ~635 lbs."
grizzly-g0858,Grizzly G0858 8-Inch Parallelogram Jointer w/ Helical Cutterhead,Grizzly,Jointer,,7/13/2026,3,230V,,,,"76 x 8 inches, cast iron",487,4,Semi-Pro,"Woodworkers who flatten hardwood often enough that tear-out has become a real problem. The 8-inch width and 76-inch bed handle long stock, and the helical head is the reason to buy this one. It needs a 230V circuit and it ships on a pallet at 487 pounds, so sort out power and delivery before it lands.","The helical cutterhead leaves a clean surface in figured maple and walnut where straight knives would tear|Parallelogram tables stay coplanar and are straightforward to dial back in|The 36 carbide inserts each rotate four times, so edge changes are rare and cheap|A mobile base is built in, so you can roll it out of the way without buying anything extra","It runs on 230V single-phase, which rules it out for shops without a dedicated circuit|At 487 pounds with dock-only delivery, getting it into the shop is a genuine project|A few owners report the fence stops are worth checking against a square before you trust them","There isn't much to upgrade here since the helical head is already fitted. Replacement inserts are Grizzly H9893, about $40 for ten, and each insert turns four times before you replace it. Most owners just add a 4-inch dust hose and a decent push block.",https://www.grizzly.com/products/grizzly-8-x-76-parallelogram-jointer-w-helical-cutterhead-mobile-base/g0858,Grizzly,2250,,,,,,,grizzly-g0490x,,grizzly-g0856,,south-bend-sb1091,,Live,7/13/2026,"Jointer #1. Phase 1.4 category_specs join test. Price 2250 verified in-stock at grizzly.com 7/13/2026. 3HP 230V single-phase, dock delivery only. 4.7/5 from 224 reviews."
grizzly-g0945,Grizzly G0945 6-Inch Benchtop Jointer,Grizzly,Jointer,,7/13/2026,1.5,120V,,,,"30 x 6-1/4 inches, cast aluminum",44,2.5,Weekend Warrior,"A first jointer for someone who wants to square up small stock without giving a floor machine any space. It bolts to a bench, weighs 44 pounds, and does fine on short boards. If you already know you'll be flattening long hardwood, you'll outgrow it quickly.",Cheap enough to find out whether you actually need a jointer|Light enough to lift onto a bench and stow away when you're done|Cuts clean edges on short stock once the fence is squared|Two knives are easy to swap and cost about twenty dollars a set,"The extruded aluminum fence is light and flexes, and it's the complaint that comes up most|At 44 pounds it walks across the bench unless you clamp or bolt it down|A 30-inch bed is too short for long boards, so you'll need infeed and outfeed support","There isn't a real upgrade path here. Replacement knives are Grizzly T32900, about twenty dollars a pair. The honest upgrade is a bigger machine, and your money goes further moving up than modifying this one.",https://www.grizzly.com/products/grizzly-6-benchtop-jointer/g0945,Grizzly,315,,,,,,,grizzly-g0946,,wen-jt3062,,cutech-40160hb,,Live,7/13/2026,"SALE PRICE: $315 (list $325), ends 7/27/26 - recheck after. 4.7/5 from 77 reviews. Straight-knife, cast aluminum tables, 11,000 RPM."
grizzly-g0946,Grizzly G0946 6-Inch Benchtop Jointer with Spiral-Type Cutterhead,Grizzly,Jointer,,7/13/2026,1.5,120V,,,,"30 x 6-1/4 inches, cast aluminum",43,2.5,Weekend Warrior,"The same benchtop as the G0945 with an insert cutterhead instead of knives, for about four dollars more. If you're choosing between the two, this is the one to get. It runs quieter, leaves less tear-out, and you rotate a dull insert rather than resetting knives.","Arrives close to coplanar and needs very little setup, which is unusual at this price|Noticeably quieter with less tear-out than a straight-knife benchtop|Twelve two-sided inserts rotate to a fresh edge instead of needing sharpening|Small enough to store on a shelf between projects",The aluminum fence is the weak spot and several owners describe it as flimsy|At 43 pounds it needs to be bolted or clamped down or it moves|Dust collection through the 2-1/2 inch port is marginal without a decent shop vac,"Replacement inserts are Grizzly T32739, roughly forty dollars for ten, and each one is two-sided. Beyond that there's no meaningful upgrade path. Owners who outgrow it move to a cast-iron floor machine rather than modify this.",https://www.grizzly.com/products/grizzly-6-benchtop-jointer-with-spiral-type-cutterhead/g0946,Grizzly,319,,,,,,,grizzly-g0945,,cutech-40160hb,,grizzly-g0947,,Live,7/13/2026,"SALE PRICE: $319 (list $375), ends 7/27/26 - recheck. 4.8/5 from 192 reviews, best-reviewed benchtop in the set. NOTE: Grizzly calls this Spiral-Type (6-row straight-set two-sided inserts) which is NOT a true shear-cutting helical head."
cutech-40160hb,Cutech 40160HB 6-Inch Spiral Cutterhead Benchtop Jointer,Cutech,Jointer,,7/13/2026,,120V,,,,30 x 6-1/4 inches,37.3,2.5,Weekend Warrior,"A benchtop spiral jointer from a small company that woodworkers keep recommending, largely for the service behind it. It goes head to head with the Grizzly G0946 and tends to arrive better calibrated. Worth a look if you want carbide inserts on a bench.","Carbide inserts run quieter than straight knives and leave a clean edge for the money|Owners repeatedly say it arrives calibrated and needs little more than squaring the fence|Cutech's customer service comes up again and again as a reason people buy it|Inserts rotate or replace individually, so one nick doesn't cost you a knife set","The aluminum fence is thin, and the cast iron fence is the add-on most owners end up buying|The 30-inch bed runs out of room on boards much over four feet|At least one long-term owner reports the tables drifting out of alignment and being awkward to re-square","The cast iron fence is the upgrade worth making and Cutech sells it directly. The head already takes twelve two-sided carbide inserts, so there's no cutterhead upgrade to chase. It carries a three-year warranty, which is longer than most of its rivals.",https://cutechtools.us/products/6-spiral-cutterhead-benchtop-jointer-black-table-cutech-40160hb,Cutech Tools,319.99,,,,,,,grizzly-g0946,,wen-jt3062,,grizzly-g0945,,Live,7/13/2026,"QA: replaces older 40160H-CT (old URL 301-redirects here). HP not published (10A only). Price moved between $299.99 promo and $319.99 list across fetches; recorded $319.99 as the safe figure. 33 reviews on cutechtools.us. Manufacturer-direct link, not a Rockler/Woodcraft affiliate partner."
wen-jt3062,WEN JT3062 6-Inch 2-Blade Benchtop Jointer,WEN,Jointer,,7/13/2026,,120V,,,,30 x 6-3/16 inches,41.1,2.5,Weekend Warrior,"The cheapest way into jointing that still does real work. It's a straight-knife benchtop with a 30-inch bed, and it's the machine people buy to find out whether they'll use one. Expect to spend an afternoon tuning it before it earns its keep.","The lowest entry price of anything here that still flattens a face and squares an edge|A 30-inch bed is longer than several benchtops that cost more|Quick-change knives make swaps painless, and you can offset a knife to work around a nick|WEN sells a cast iron fence for it, which fixes the machine's main weakness cheaply","The aluminum fence is hard to lock down square, and it dominates owner complaints|There's no outfeed table adjustment, so if the tables aren't coplanar from the factory you're shimming them|Even at 30 inches the bed is short, and long stock needs support","The WEN JTA424 cast iron fence bolts straight on, and it's the upgrade almost everyone recommends since the stock fence is the weak link. Replacement blades are JT3062B. Past that, you're better off saving toward a cast-iron floor machine.",https://wenproducts.com/products/wen-jt3062-10-amp-6-inch-2-blade-benchtop-jointer,WEN,314.99,https://www.homedepot.com/p/WEN-10-Amp-6-in-2-Blade-Benchtop-Jointer-JT3062/320287582,Home Depot,237.77,,,,grizzly-g0945,,cutech-40160hb,,grizzly-g0946,,Live,7/13/2026,"OPEN AFFILIATE QUESTION: cheapest verified price is Home Depot $237.77 (4.6/5, 92 reviews) - big-box affiliate program still unsettled. WEN direct $314.99, in stock. Both links verified 7/13/2026. HP not published (10A). Replaces WEN 6559 which is DISCONTINUED with no in-stock price anywhere."
grizzly-g0947,Grizzly G0947 8-Inch Benchtop Jointer with Spiral-Type Cutterhead,Grizzly,Jointer,,7/13/2026,1.5,120V,,,,"34 x 8-1/4 inches, cast aluminum, extends to 52 inches",50,4,Hobbyist,"Eight inches of cut width on a bench, which is the main reason to pick this over a 6-inch machine. The tables pull out to 52 inches, so it handles longer stock than its footprint suggests. A good fit if your shop is a garage and a floor jointer isn't happening.","You get 8-inch capacity without giving up floor space, and that's the whole pitch|Built-in extensions take support from 34 inches to 52, which owners say makes a real difference on edges|The 4-inch dust port collects far better than the 2-1/2 inch port on the 6-inch models|Spiral inserts cut cleanly and quietly on figured stock","Snipe at the ends of boards comes up regularly in owner reports|Squaring the fence is fiddly and the aluminum fence can deflect under load|Tables are cast aluminum rather than iron, and at 50 pounds it needs securing to the bench","It takes the same Grizzly T32739 inserts as the 6-inch models, around forty dollars for ten. There's no cutterhead upgrade to make since the insert head is already fitted. The next real step is a cast-iron floor machine.",https://www.grizzly.com/products/grizzly-8-benchtop-jointer-with-spiral-type-cutterhead/g0947,Grizzly,481,,,,,,,wen-jt833h,,grizzly-g0986,,grizzly-g0946,,Live,7/13/2026,"SALE PRICE: $481 (list $535), ends 7/27/26 - recheck. 4.7/5 from 115 reviews (Grizzly), 4.8/5 from 180 (Home Depot). SPEC CONFLICT: product page says 12,000 RPM, the 7/9/2026 data sheet says 11,000 (66,000 cuts/min over 6 rows = 11,000). Used 11,000."
wen-jt833h,WEN JT833H 8-Inch Spiral Benchtop Jointer with Extendable Table,WEN,Jointer,,7/13/2026,,120V,,,,"33 x 8 inches, extends to 51 inches",55.1,4,Hobbyist,"WEN's answer to the 8-inch benchtop, undercutting Grizzly slightly and adding a longer extended table. Owners like the motor and the finish it leaves. The catch is setup, so plan on real time getting the tables coplanar before you trust it.","The motor pulls through dense 8/4 hickory without bogging, which surprises people at this price|The spiral head leaves a smooth surface with very little tear-out|Extensions reach 51 inches of support, which is generous for a benchtop|Two-year warranty and replacement blades are easy to get","It often arrives with the tables out of alignment, and owners describe hours of leveling to fix it|The fence isn't reliably flat and needs re-squaring, which is the most common gripe|Aluminum tables and HSS inserts rather than carbide, so both wear faster in hardwood","The JTA424 cast iron fence bolts on and answers the fence complaint. Replacement spiral blades are BP510H. The inserts are HSS rather than carbide, so if you run a lot of hardwood expect to change them more often than on a carbide head.",https://wenproducts.com/products/wen-jt833h-10-amp-8-inch-spiral-benchtop-jointer-with-extendable-table,WEN,499.99,,,,,,,grizzly-g0947,,grizzly-g0986,,wen-jt3062,,Live,7/13/2026,"QA: review count NOT verified - wenproducts.com shows no review widget; the 72-review figure could not be confirmed. Community points sourced from Home Depot reviews and LumberJocks. HP not published (10A). SPEC CONFLICT: marketing says 12,000 cuts/min, manual says 11,000 RPM - used 11,000."
grizzly-g0986,Grizzly G0986 10-Inch Benchtop Jointer with Spiral-Type Cutterhead,Grizzly,Jointer,2025,7/13/2026,1.75,120V,,,,"30-3/4 x 10-1/4 inches, cast iron, 55 inches with extensions",76,4,Hobbyist,"Ten inches of width on a benchtop, with cast iron tables instead of aluminum. That combination barely exists elsewhere at this price. It's the pick if you want to face wide boards but still can't give up the floor space.","Cast iron tables rather than aluminum, so it damps vibration and holds flat better than its benchtop rivals|Ten inches of width lets you face boards a 6-inch machine simply can't take|Owners say it runs quieter than expected and arrives close to ready|The 24-inch fence is noticeably more rigid than the usual 20-inch benchtop fence","The fence can still deflect under a heavy hardwood cut, and at least one owner fitted an aftermarket one|At 76 pounds it wants a genuinely solid bench under it|The bed is short relative to the width, so the extensions aren't optional on long stock","It uses the same indexable inserts as Grizzly's other benchtops, around forty dollars for ten. This is a 2025 model so the aftermarket is still thin. There's no cutterhead upgrade to make and no real reason to want one.",https://www.grizzly.com/products/grizzly-10-benchtop-jointer-with-spiral-type-cutterhead/g0986,Grizzly,628,,,,,,,grizzly-g0947,,wen-jt833h,,grizzly-g0958,,Live,7/13/2026,"SALE PRICE: $628 (list $698), ends 7/27/26 - recheck. New for March 2025 so only 27 reviews (4.7/5) - thinner community data than the 6in/8in models. Cast iron tables are the differentiator."
grizzly-g0958,Grizzly G0958 8-Inch Combo Planer/Jointer with Helical Cutterhead,Grizzly,Jointer,,7/13/2026,1.5,120V,,,,Jointer 29-1/4 x 8-1/4 inches; planer 13-3/4 x 8 inches,57,2.5,Hobbyist,"One machine that joints and planes, which is the whole reason to consider it. If your shop is small and you need both jobs done, this buys you the pair for the price of one. You pay for that with a changeover every time you switch modes.","A real helical head with 18 carbide inserts at this price is unusual, and it shows in the finish|Once you've done it a few times the changeover takes under a minute|It's the lightest combo machine Fine Woodworking tested, so it moves and stores easily|It adds thickness planing to a shop that had no room for a second machine","Planer mode leaves snipe that testers couldn't fully dial out, though a jointer pass removes it|Changeover means remounting the fence, dropping the planer bed, and moving the dust shroud, so it's a chore if you switch often|The dust shroud itself is awkward to work around","Inserts are Grizzly H9893 and they're four-sided, so each one turns three times before it's spent. There's nothing else to upgrade. If the changeover starts to annoy you, that's your signal to buy separate machines.",https://www.grizzly.com/products/grizzly-8-combo-planer-jointer-with-helical-cutterhead/g0958,Grizzly,749,,,,,,,grizzly-g0959,,grizzly-g0986,,grizzly-g0947,,Live,7/13/2026,"TIER NOTE: $749 sits in the Serious Hobbyist price band, but this is a 57 lb die-cast-aluminum BENCHTOP combo, so tiered Hobbyist on build and use. 4.3/5 from 113 reviews. SPEC CONFLICTS on Grizzly own page: dust port 2-1/2in (features) vs 2in (description); weight 57 lb (specs) vs 60 lb (sidebar). Fine Woodworking cites 9,500 RPM vs Grizzly 8,500 - used manufacturer figure."
