machine_slug,machine_name,manufacturer,category,release_year,price_last_updated,motor_hp,voltage,blade_size,cut_capacity_height,cut_capacity_width,table_dimensions,weight_lbs,dust_port_diameter,tier,who_its_for,owner_praise,owner_limitations,upgrade_compatibility,affiliate_link_1,affiliate_retailer_1,affiliate_price_1,affiliate_link_2,affiliate_retailer_2,affiliate_price_2,affiliate_link_3,affiliate_retailer_3,affiliate_price_3,compare_1_slug,compare_1_note,compare_2_slug,compare_2_note,compare_3_slug,compare_3_note,status,date_published,notes
bauer-9in-benchtop-band-saw-70630,Bauer 1/3 HP 9 in. Benchtop Band Saw (SKU 70630),Bauer,Band Saw,2024,7/6/2026,0.33,110V,59.5 in.,3.5,9,"Cast aluminum, tilts 0-45 degrees",36.5,2.5,Weekend Warrior,"This saw is for someone who needs an occasional-use band saw for light woodworking, scroll work, or hobby projects and wants the lowest possible entry price. The 9-inch throat and 3.5-inch max cut height make it suitable for thin stock, small curves, and craft work. It is not a resawing tool and is not suited to anyone expecting to cut hardwood regularly or work with stock thicker than 2-3 inches. If you're buying your first band saw and aren't sure you'll use it heavily, this is a low-risk entry point. If you already know you'll use it regularly, spend more and start with a 14-inch floor model.",Build quality above expectations for the price -- all-metal covers vs plastic-bodied competitors | Quick setup; table and blade arrive reasonably square out of the box | Compact footprint works well for small shops | Rack and pinion table tilt adjustment uncommon at this price point,Motor struggles with curves in thicker hardwood | Included blade is functional but most owners replace it early | Fence requires initial drift adjustment | Resaw capability minimal -- suited to stock under 2 inches,Takes 59.5-inch blades 1/8 to 1/2 inch wide. Olson and Timber Wolf recommended aftermarket brands. 2.5-inch dust port compatible with standard shop vac hoses with adapter. No known aftermarket fence upgrade for this model.,https://www.harborfreight.com/13-hp-9-in-benchtop-band-saw-70630.html,Harbor Freight,179.99,,,,,,,wen-ba3959,Near-identical specs at a slightly lower price; longer track record of owner reviews; safer choice if documented community data matters to you,rikon-10-3061,The Rikon 10-3061 is a 10-inch cast-iron deluxe benchtop with a 1/2 HP two-speed motor — significantly more cutting capability and community support for a modest premium.,,,Live,6/7/2026,Thin community data -- SKU 70630 has zero reviews on HF site as of June 2026. Recommend holding in Draft until owner reviews accumulate. Specs verified against Harbor Freight product page.
wen-ba3962,WEN BA3962 3.5-Amp 9-Inch Benchtop Band Saw,WEN,Band Saw,2022,7/6/2026,,110V,72 inches,6,9.75,14.125 x 12.5 inches,73.5,4,Hobbyist,Buyers who need a capable benchtop bandsaw with stand for hobby cutting in softwood and light hardwood. Two-speed operation covers detail work and light resawing up to 6 inches deep. Not suited for resawing thick hardwood regularly or production-level work; step up to a 14-inch floor model for those needs.,"Two-speed operation gives flexibility for different materials and blade widths | Worklight, fence, and miter gauge included at the price point | Stable table handles typical hobbyist cutting tasks | Three-in-one dust port fits 1-3/4, 2-3/4, and 4-inch hoses | 73.5-lb weight is manageable for benchtop repositioning",Speed changes require loosening the motor mount to move the drive belt rather than a quick-release lever | Blade replacement is complex for first-time bandsaw owners | Worklight position is fixed and does not consistently illuminate the cut line | Resaw capacity limited to 6 inches restricts work with wider boards,Accepts 72-inch blades 1/8 to 1/2 inch wide. Three-in-one dust port fits standard shop vac hoses. Fence and miter gauge included. Aftermarket upgrade path is limited; this is a self-contained tool rather than a platform with an accessory ecosystem.,https://wenproducts.com/products/wen-ba3962-3-5-amp-10-inch-two-speed-band-saw-with-stand-and-worklight,WEN,399.25,,,,,,,rikon-10-3061,"The Rikon 10-3061 offers a cast-iron table and 1/2 HP two-speed motor in a 10-inch benchtop, with more cut depth but no stand.",wen-ba3959,The WEN BA3959 is a smaller 9-inch model at roughly half the price for the most basic cutting needs.,jet-jwbs-10os,The Jet JWBS-10OS steps up to 1/2 HP and a 4-inch dust port for buyers wanting more capability.,Live,2026-06-08,Link verified 2026-07-06: WEN direct $399.25 (in stock). Not carried by Rockler/Woodcraft/Acme/Advanced Machinery. Amazon ASIN B09X1ZD8MH still active but price not machine-verifiable — add manually if desired. Single verified retailer.
wen-ba3959,WEN BA3959 9-Inch Band Saw,WEN,Band Saw,2022,7/6/2026,,110V,59.5 inches,3.5,9,12.25 x 11.875 inches,40,2.5,Weekend Warrior,"Entry-level buyers who need basic bandsaw capability for light hobby crafts, occasional curved cuts, or learning bandsaw fundamentals without significant investment. The 9-inch throat and 3.5-inch cut limit restrict this saw to softwoods, thin stock, and scrollwork. Buyers who plan to use a bandsaw more than occasionally or who want to work with any hardwood should start with a 10-inch model instead.","At 40 lbs and under $150, portability and price are unmatched in the category | Fence and miter gauge included at this price point | 2-1/2 inch dust port keeps the work area reasonably clean | Sufficient for light scrollwork and craft cutting in softwood",3.5-inch cut capacity limits the saw to thin stock only | Single-speed at 2500 FPM offers no flexibility for different materials | Community discussion of this specific model is limited | No horsepower rating published by manufacturer | Blade width maxes at 3/8 inch restricting any resawing,Accepts 59-1/2 inch blades 1/8 to 3/8 inch wide. POWERTEC sells compatible 59-1/2 inch replacement blades. Standard 2-1/2 inch dust port. Fence and miter gauge included. No meaningful aftermarket accessory ecosystem for this model.,https://www.amazon.com/WEN-9-Inch-2-8-Amp-Benchtop-BA3959/dp/B0BK2V91VW,Amazon,139.48,,,,,,,wen-ba3962,"The WEN BA3962 steps up to two-speed operation, a larger table, and an included stand for about $200 more.",rikon-10-3061,The Rikon 10-3061 offers a cast-iron 10-inch platform with a 1/2 HP two-speed motor for roughly double the price with significantly more cutting capability.,,,Live,6/8/2026,Community data thin for this model. HP not published by manufacturer. Set to Draft pending more owner discussion.
jet-jwbs-10os,Jet JWBS-10OS 10-Inch Band Saw,Jet,Band Saw,2010,7/6/2026,0.5,110V,67.5 inches,4.125,9.5, 13.125 x 13.375 inches,71,4,Hobbyist,"Buyers who want a brand-name 10-inch bandsaw with quality open stand, 1/2 HP motor, and Jet warranty coverage for regular hobby cutting. The 4-inch dust port supports proper dust management where smaller competitors use 2.5-inch ports. Buyers who expect to grow beyond 10-inch capacity within a year or two should save the investment and step directly to a 14-inch floor model.",Jet brand reputation and service network provides warranty assurance | 4-inch dust port is larger than most 10-inch competitors | Cast iron table tilts cleanly | LED worklight standard | 1/2 HP motor handles softwood and light hardwood reliably,QA issues documented in community discussions particularly regarding wheel tires | Motor is underpowered for any meaningful hardwood resawing | 10-inch class limitation means buyers typically outgrow the saw within a couple of years | Table dimensions not published in standard manufacturer documentation,"Accepts 67-1/2 inch blades. Four-inch dust port connects to most shop vacuums directly. Jet sells replacement tires and blade guides. Takes standard 10-inch bandsaw blade sizes from Lenox, Timber Wolf, and others. Stock blade is 67.5 x .375 x .014 6TPI.",https://www.rockler.com/jet-jwb-10-open-stand-10-bandsaw,Rockler,736.99,https://www.woodcraft.com/products/jet-10-bandsaw-with-open-stand-1-2-hp-1-ph-115v-jwb-10,Woodcraft,736.99,,,,wen-ba3959,"The WEN BA3959 is a smaller 9-inch benchtop at a much lower price for basic cutting, without the Jet's cast-iron table or 4-inch dust port.",wen-ba3962,The WEN BA3962 offers two-speed operation and a worklight at a lower price but with lighter-duty construction.,rikon-10-3061,The Rikon 10-3061 matches the 1/2 HP motor with two-speed capability and a 5-inch cut depth at a comparable price.,Live,6/8/2026,Verified 2026-07-06. Model now sold as successor JWB-10. Rockler $736.99 and Woodcraft $736.99 (new live URL) both in stock. Rockler price corrected from stale $629.99. Old dead Woodcraft link replaced.
rikon-10-3061,Rikon 10-3061 10-Inch Deluxe Band Saw,Rikon,Band Saw,2019,7/6/2026,0.5,110V,70.5 inches,5,9.625,13.75 x 12.5 inches,77.5,2.5,Hobbyist,"Buyers who want more from a 10-inch benchtop bandsaw than the basic 10-305 - specifically two-speed operation, a 1/2 HP motor, and a 5-inch cut depth. Good for woodturners and hobbyists cutting curved work in softwoods. Community QC reports suggest careful inspection at purchase; buyers who need production reliability or significant resawing capacity should move directly to a 14-inch floor model.",Two-speed operation (1515 and 3280 FPM) gives flexibility across blade types and materials | 1/2 HP motor is a meaningful step up from the 1/3 HP 10-305 | 5-inch cut depth is the maximum available in the 10-inch benchtop class | Rikon customer service responds quickly to warranty claims per community reports,Quality control issues documented by owners including a wheel alignment plate breaking during early use | Miter slot is 5/8 inch non-standard limiting compatible aftermarket miter gauge options | Community feedback volume is lower than for the 10-305 | Weight not published by manufacturer,Accepts 70-1/2 inch blades 1/8 to 1/2 inch wide at two speeds. Two-and-a-half-inch dust port. Note: 5/8-inch non-standard miter slot limits aftermarket miter gauge compatibility. Fence included. Rikon accessories compatible.,https://www.woodcraft.com/products/rikon-10-deluxe-bandsaw-1-2-hp,Woodcraft,539.99,,,,,,,wen-ba3962,"The WEN BA3962 offers a similar two-speed 10-inch benchtop with a stand and worklight at a lower price, though with a lighter-duty frame.",jet-jwbs-10os,The Jet JWBS-10OS matches the 1/2 HP motor with a larger 4-inch dust port and open stand at a similar price.,,,Live,6/8/2026,NOTE: This is a 10-inch bandsaw - user listed as 14-inch in error. Specs confirmed against Rikon product page. Weight not published. QC concerns documented in community. Set to Draft for QA review.
laguna-1412,Laguna 14|12 14-Inch Band Saw,Laguna,Band Saw,2013,7/6/2026,1.75,Dual,115 inches,12,13,"21.5 x 16 inches, aluminum",258,4,Semi-Pro,"Buyers who want European bandsaw design features - ceramic blade guides, a precision aluminum fence, and a large 21.5x16 inch table - at a price below full industrial machines. The 1.75 HP motor on 110V handles demanding hobbyist resawing comfortably and the saw operates quietly. Tall woodworkers should note the lower-than-standard table height; buyers who need continuous production resawing should look at the Laguna 14|BX or a higher-HP competitor.",Ceramic blade guides eliminate heat buildup and extend blade life | No-tools blade installation and guide adjustment is faster than any competitor in this class | Runs quietly with exceptionally low vibration per consistent community reports | 21.5 x 16 inch table is among the largest in the 14-inch class | Premium Hi/Low aluminum fence is standard equipment,Table height sits lower than standard 14-inch competitors - a problem for taller woodworkers | No miter gauge included; must be purchased separately | Laguna mobility kit reported as dangerously unstable in transport mode | Ceramic guides can spark during resawing with some owners reporting smoke from lower guides | 25-30 second coast-down time with no blade brake,Accepts 115-inch blades 1/8 to 3/4 inch wide. Four-inch dust port. Laguna Ceramic Cool Blocks with replacements from Laguna and third parties. Compatible blades include Lenox and Woodslicer. No miter gauge included; standard 3/4-inch miter slot accepts aftermarket options. Hi/Low aluminum fence adjusts for drift.,https://www.rockler.com/laguna-1412-14bandsaw,Rockler,1699,https://www.acmetools.com/laguna-tools-1412-bandsaw-mba1412175/640213050098.html,Acme Tools,1699,,,,jet-jwbs-14sfx,"The Jet JWBS-14SFX offers a 1.75 HP steel-frame saw with 13-inch resaw at a lower price, though without the Laguna's ceramic guides and tool-free adjustments.",grizzly-g0555,The Grizzly G0555 offers a similar 14-inch cast-iron floor format at roughly half the price but with only 6 inches of native resaw capacity.,powermatic-pm1500b,The Powermatic PM1500B steps up to 3 HP and 14 inches of resaw capacity at a significantly higher price for industrial-level demands.,Live,6/8/2026,"Verified 2026-07-06. Rockler $1,699 and Acme Tools $1,699 both in stock. Woodcraft still dead — replaced with Acme."
powermatic-pm1500b,Powermatic PM1500B 15-Inch Band Saw,Powermatic,Band Saw,2012,7/6/2026,3,220V,153 inches,14,14.5,"21.5 x 16 inches, cast iron",400,4,Semi-Pro,"Buyers who need sustained high-capacity resawing that 1 and 1.75 HP machines cannot provide. The 3 HP motor at 230V handles full-width resawing in dense hardwood without strain, and the 14-inch resaw capacity covers the most demanding hobbyist and semi-professional work. Requires a dedicated 230V circuit and substantial floor space. Buyers who do not regularly push resawing limits should evaluate whether this investment is warranted compared to a 1.75 HP machine at roughly half the cost.","Three HP motor handles demanding hardwood resawing without strain - community consistently notes it cuts anything like butter | Excellent fit and finish with precision-ground cast iron surfaces | All adjustments are tool-free including tracking, guides, and tension | Dust collection performance is notably better than expected for a bandsaw | Welded steel frame at nearly 400 lbs dampens vibration to a level other saws cannot match",Requires 230V dedicated circuit restricting placement and adding electrical cost | At nearly 400 lbs positioning requires a hand truck and a second person | Dust collection screen clogs with green wood shavings and thin strips during extended resawing | Price is significantly above 1.75 HP competitors that cover most hobbyist resawing needs | 80-inch overall height can be a problem for low-clearance shop spaces,"Accepts 153-inch blades 1/8 to 1 inch wide. Four-inch dust port. All adjustments tool-free. Includes rip fence and miter gauge. Large 21.5x16 cast iron table. Powermatic stocks OEM replacement blades (PM1500-021). Compatible with Woodslicer, Lenox, and Timber Wolf blades. 230V single-phase prewired. Mobile base sold separately.",https://www.rockler.com/powermatic-pm1500-bandsaw-3hp-1ph-230v,Rockler,4179,https://www.woodcraft.com/products/powermatic-15-woodworking-bandsaw-3-hp-1-ph-230v-pm1500,Woodcraft,4179,https://www.acmetools.com/powermatic-pm1500-3hp-1ph-230v-bandsaw-1791500/731325224269.html,Acme Tools,4179,laguna-1412,The Laguna 14|12 offers 1.75 HP with ceramic guides on 110V at roughly half the price for buyers who do not need 3 HP performance.,grizzly-g0513x2,"The Grizzly G0513X2 offers a larger 17-inch throat with 2 HP at under half the price, trading the Powermatic's 3 HP and premium build for more capacity per dollar.",,,Live,6/8/2026,"Verified 2026-07-06. Rockler, Woodcraft (now live), and Acme Tools all $4,179 in stock. Woodcraft link restored."
grizzly-g0555,Grizzly G0555 14-Inch 1 HP Bandsaw,Grizzly,Band Saw,2005,7/6/2026,1,Dual,93-1/2 inches,6,13.5,"14 x 14 inches, cast iron",190,4,Serious Hobbyist,"The G0555 handles everyday cuts, curves, and light resawing up to 6 inches across a precision-ground cast iron table that outclasses aluminum alternatives at this price. The buyer wants an established 14-inch saw with a deep parts ecosystem and 20-plus years of community knowledge behind it. Buyers planning regular wide-board resawing should budget for the H3051 riser block or consider the G0555LX, which offers more capacity at a modest premium.","Precision-ground cast iron table consistently praised for flatness and stability — owners compare it favorably to far more expensive saws|Decades of continuous production means parts, riser blocks, replacement guides, and aftermarket fences are widely available|Fence and miter gauge included at no extra cost — comparable to what competitors charge as add-ons|H3051 riser block kit expands resaw capacity to 12 inches without replacing the saw|Two-speed pulley (1500/3200 FPM) allows basic material versatility across wood and some non-ferrous use","6-inch resaw capacity is the defining limitation — most buyers wanting serious resawing need the riser block kit|14 x 14 inch table is smaller than competing 14-inch saws at similar prices|1 HP motor shows strain on wide, dense hardwood resaw passes near maximum depth|Owners who outgrow it describe it as a stepping stone rather than a long-term keeper without the riser upgrade","Accepts 92-1/2 to 93-1/2 inch blades, 1/8 to 3/4 inch wide; Grizzly H3051 riser block raises resaw capacity to 12 inches; Carter Products and Kreg aftermarket fences fit; Timber Wolf, Lenox, and Olson blades are direct replacements; 4-inch dust port connects to standard shop vacuum; 2-speed pulley belt is user-swappable",https://www.grizzly.com/products/grizzly-14-1-hp-bandsaw/g0555,Grizzly,825,,,,,,,grizzly-g0513x2,"The Grizzly G0513X2 steps up to a 17-inch throat and 2 HP for buyers who want significantly more capacity, at roughly double the price.",delta-28-400,"Delta 28-400 has a larger table and steel frame at a lower original price, though the G0555 has a deeper parts and riser block upgrade ecosystem.",,,Live,6/11/2026,"Verified 2026-07-06: Grizzly direct $825 (in stock, +freight). Amazon B0000DD0AC ($935.29) not machine-verifiable — add manually if desired. Single verified retailer."
jet-jwbs-14sfx,Jet JWBS-14SFX 14-Inch Steel Frame Band Saw,Jet,Band Saw,2014,7/6/2026,1.75,Dual,116 inches,13,13.5,"21 x 17 inches, cast iron",272,4,Semi-Pro,"The JWBS-14SFX handles demanding resawing, tight curves, and production-volume cuts with a 1.75 HP motor and 360 square inches of cast iron work surface. The buyer uses a bandsaw near-daily, values independently adjustable ball bearing guides over entry-level systems, and wants 13 inches of resaw capacity on a solid platform. Buyers needing two-speed operation for non-ferrous or detail work should compare the Rikon 10-326 at a similar price.",360 square inch cast iron table (21 x 17 inches) provides stable support for large panels that smaller competing tables cannot match|Independently adjustable ball bearing blade guides above and below the table outperform the guide standard at lower price points|1.75 HP motor sustains hardwood resawing without the hesitation reported on 1 HP alternatives|Dual-height aluminum fence serves both resaw and rip work — owners report meaningful versatility without an aftermarket fence upgrade|Dual 4-inch dust ports substantially improve dust collection over single-port saws,Single speed (3000 SFPM) limits use on non-ferrous materials or detail work requiring a slower blade speed|Stock blade requires replacement before serious use — owners consistently replace it immediately|Plastic hand wheels on tensioning and guide height adjustment are a cost-cutting decision owners notice at this price|Steel frame body is lighter and less vibration-dampening than fully cast construction at this price point,"Accepts 116-inch blades, 1/8 to 3/4 inch wide; dual 4-inch dust ports accommodate most shop dust collection systems; Kreg bandsaw fence fits as an aftermarket upgrade; Cool Blocks or Carter blade guides compatible; 1/2-inch blade included at purchase; 5-year JET warranty",https://www.rockler.com/jet-jwbs-14sfx-14-bandsaw-13-resaw-capacity,Rockler,1549,https://www.acmetools.com/jet-jwbs-14sfx-14in-steel-frame-bandsaw-1-3-4hp-115-230v-714400k/731325741162.html,Acme Tools,1549,,,,jet-jwbs-14cs,The Jet JWBS-14CS is Jet's budget 14-inch saw with a 1 HP motor and 6-inch resaw at a lower price for lighter-duty work.,rikon-10-326,Rikon 10-326 offers two blade speeds and spring-loaded tool-free guides at a similar price — better suited to multi-material cutting.,laguna-14bx,Laguna 14BX adds a magnetic disc brake and ceramic guide system at a higher price.,Live,6/11/2026,"Verified 2026-07-06. Rockler $1,549 in stock. Acme Tools $1,549 (source flags end-of-life — monitor). Woodcraft still dead — replaced with Acme."
laguna-14bx,Laguna 14|BX 14-Inch Band Saw,Laguna,Band Saw,2014,7/6/2026,1.75,110V,115 inches,13,,"21.5 x 16 inches, cast iron",260,4,Semi-Pro,"The 14BX is the upmarket version of the 14|12, adding a one-piece heavier-gauge frame, cast iron wheels, a magnetic disc brake, and a magnetic on/off switch. The buyer is a serious woodworker who uses the bandsaw as a primary machine and values the disc brake as a meaningful safety and workflow upgrade over competing saws at this price. Buyers who can accept the 14|12's lighter frame and no brake will find the same 13-inch resaw capacity at a significantly lower price.",Disc brake that stops the blade in seconds is consistently cited by owners as more useful than expected — meaningfully changes shop workflow|One-piece heavy-gauge frame and cast iron wheels reduce vibration compared to the lighter 14|12 construction|Laguna ceramic guides outperform bearing guides in sustained resawing — owners report closer positioning and better cut quality|Dual light mounting positions and magnetic on/off switch are quality-of-life details absent from competing saws|Quick-release tension lever and worm gear rack and pinion guide adjustment streamline setup between blade changes,"Quality control issues documented by owners — upper wheel spoke alignment, guide blocks not flat or square, and wheel runout requiring factory correction|Sold exclusively through dealer network — no direct purchase option, limiting price comparison shopping|Blade not included at purchase — buyers must add 115-inch blade cost to initial purchase price|At $2,149 the price is above the Semi-Pro ceiling but the community frames it as a serious hobbyist upgrade rather than a production shop machine","Takes 115-inch blades, 1/8 to 3/4 inch wide with stock ceramic guides; Laguna Mini Guides accessory enables blades narrower than 1/4 inch; Laguna Resaw King carbide-tipped blade (3/4 x 115 inch) is the recommended resawing blade; optional mobility wheel kit available; dual 4-inch dust ports; 110V outlet on rear for optional work light (sold separately)",https://www.rockler.com/laguna-14bx-1-75hp-bandsaw110v,Rockler,2149,https://www.advmachinery.com/products/laguna-14bx-bandsaw,Advanced Machinery,2149,,,,laguna-1412,"Laguna 14|12 uses the same resaw capacity at a substantially lower price — the 14BX's frame, brake, and cast iron wheels justify the premium only for heavy daily use.",jet-jwbs-14sfx,"Jet JWBS-14SFX costs less and adds a 360 sq in cast iron table, but lacks the disc brake and Laguna ceramic guide system.",rikon-10-326,Rikon 10-326 offers two blade speeds and a comparable cast iron table at a significantly lower price.,Live,6/11/2026,"Verified 2026-07-06. Rockler $2,149 and Advanced Machinery $2,149 (price now populated), 110V model. Woodcraft dead — replaced."
