machine_slug,machine_name,manufacturer,category,release_year,price_last_updated,motor_hp,voltage,blade_size,cut_capacity_height,cut_capacity_width,table_dimensions,weight_lbs,dust_port_diameter,tier,who_its_for,owner_praise,owner_limitations,upgrade_compatibility,affiliate_link_1,affiliate_retailer_1,affiliate_price_1,affiliate_link_2,affiliate_retailer_2,affiliate_price_2,affiliate_link_3,affiliate_retailer_3,affiliate_price_3,compare_1_slug,compare_1_note,compare_2_slug,compare_2_note,compare_3_slug,compare_3_note,status,date_published,notes
powermatic-pm1800b,Powermatic PM1800B 18-Inch Band Saw,Powermatic,Band Saw,2012,7/6/2026,5,220V,160 inches,18,18,"24 x 27 inches, cast iron",616,4,Professional,"The PM1800B handles industrial-volume resawing and continuous production work with 5 HP and 18 inches of cutting capacity in both height and width. The buyer is a professional woodworker, production shop operator, or institution running the saw near-continuously and expecting decades of service. Buyers who want 18-inch capacity for occasional resawing should weigh whether the PM1500B meets the same need at lower cost.",Solid cast iron upper and lower wheels create exceptional momentum for sustained heavy resaw — owners report smooth cutting through wide hardwoods at full 18-inch capacity|5 HP motor provides far more power than any cutting scenario demands — the saw never labors regardless of species or stock thickness|Two-speed pulley (2300/4400 SFPM) enables genuine versatility across wood species and demanding applications|Heavy-duty fence handles production-volume ripping without flex or drift|Overall build quality described as industrial-grade with minimal adjustment required out of the crate,Requires dedicated 230V circuit — not suitable for shops without appropriate electrical infrastructure|616 lbs net weight makes repositioning impractical — owners recommend treating final placement as permanent|1-1/4 inch clearance at blade guides is tight for inserting and removing the maximum 1-1/2 inch blade — owners note the tolerance as a minor annoyance|Geared wheel for table tilt adjustment reported as sloppy compared to the rest of the machine's precision|No included work light at this price point — owners consider it an omission,Accepts 160-inch blades up to 1-1/2 inches wide; solid steel resaw post included; high-end blade guides standard; blade tension release with electrical interlock; 230V dedicated circuit required; 3-phase version (PM1800B-3) available for production shop environments; Powermatic full parts and service network,https://www.woodcraft.com/products/powermatic-18-woodworking-bandsaw-5-hp-1-ph-230v-pm1800b,Woodcraft,7776,https://www.advmachinery.com/products/powermatic-pm1800b-18-bandsaw,Advanced Machinery,7776,,,,powermatic-pm1500b,Powermatic PM1500B offers 15-inch capacity at a lower price — the practical choice for buyers who don't need full 18-inch production capacity.,grizzly-g0513x2,The Grizzly G0513X2 provides 17-inch capacity and 2 HP at a significantly lower price for buyers who don't need 5 HP output.,,,Live,6/11/2026,"Price not confirmed — typical range $3,499-$4,299; verify at Woodcraft and Advanced Machinery before going Live. Dust port diameter not published in available sources; left blank. Resaw capacity height and width both set to 18 per 18-inch bandsaw wheel size."
rikon-10-326,Rikon 10-326 14-Inch Deluxe Band Saw,Rikon,Band Saw,2016,7/6/2026,1.75,Dual,111 inches,13,13.63,"21.5 x 15.75 inches, cast iron",285,4,Semi-Pro,"The Rikon 10-326 resaws up to 13 inches, runs at two blade speeds, and adjusts guides tool-free — a package designed for woodworkers who want a capable 14-inch saw without moving to premium Laguna or Powermatic pricing. The buyer uses a bandsaw regularly, values two-speed versatility for both wood and non-ferrous work, and wants a heavy cast iron table without paying for the disc brake and ceramic guide systems of the Laguna 14BX. Buyers who primarily cut wood at a single speed can save significantly with the Jet JWBS-14SFX.",Two blade speeds (1445 and 2950 FPM) give genuine multi-material capability owners consistently use for both wood and non-ferrous work|Spring-loaded tool-free blade guide adjustment is notably faster than competitor systems — owners cite this as a daily quality-of-life improvement|1.75 HP handles sustained hardwood resawing through wide boards including hard maple without hesitation|Quick-lock trunnion table angle system and quick-release blade tension lever streamline blade changes|5-year Rikon warranty with customer service cited as above-average for this price point,"Factory setup requires adjustment out of the box — owners consistently report needing to square the table and check guide alignment before first use|Frame weld alignment issues in documented cases — off-square installation requires hands-on correction before trusting the saw|Adjustment bolt on the fence head falls into the miter slot, making fence positioning a two-handed operation|Max blade width is 5/8 inch — narrower than the 3/4 inch standard on competing saws at this price","Accepts 111-inch blades, 3/16 to 5/8 inch wide; 4-inch dust port in lower wheel compartment; 6-inch tall rip fence with re-saw bar included; spring-loaded guides accept standard Cool Blocks as replacements; Timber Wolf and Lenox 111-inch blades are direct fits; optional mobility kit available from Rikon",https://www.rockler.com/rikon-10-326-deluxe-14-bandsaw,Rockler,1899.99,https://www.woodcraft.com/products/rikon-14-deluxe-bandsaw-1-3-4-hp,Woodcraft,1359.99,,,,jet-jwbs-14sfx,Jet JWBS-14SFX has a larger table and single speed at a lower price — the better choice for buyers who don't need two-speed operation.,laguna-14bx,Laguna 14BX adds a disc brake and ceramic guides but costs $550 more — justified only for heavy daily use where those features pay off.,grizzly-g0513x2,"The Grizzly G0513X2 steps up to a 17-inch throat and 2 HP for buyers who need more capacity, at a higher price.",Live,6/11/2026,"Verified 2026-07-06. HIGHLAND LINK REMOVED (discontinued affiliate). Replaced with Rockler $1,899.99 and Woodcraft $1,359.99 (sale, new live URL), both in stock."
delta-28-400,Delta 28-400 14-Inch 1 HP Steel Frame Band Saw,Delta,Band Saw,2011,7/6/2026,1,Dual,93-1/2 inches,6,13.63,"15.75 x 18.875 inches, cast iron",164.9,4,Serious Hobbyist,The Delta 28-400 brings a cast iron table and two-speed steel frame construction to the 14-inch hobbyist market at a lower price than cast iron alternatives. The buyer wants proven Delta construction without the premium of a cast iron body — a meaningful step up from cast aluminum in rigidity at a competitive price. Buyers who plan to resaw regularly will hit the 6-inch limit quickly and should look at the Grizzly G0555 or G0555LX for an expandable alternative.,Cast iron table described by owners as flat and smooth — one reviewer compared surface quality favorably to a UniSaw|Steel frame provides better rigidity and vibration dampening than cast aluminum competition at this price point|Two-speed operation (1620/3340 FPM) gives practical versatility across wood types and some non-ferrous materials|Setup goes smoothly per owners who followed the manual — vibration-free operation reported after break-in|Delta brand carries decades of service infrastructure owners rely on for long-term parts and support,"6-inch resaw capacity is the primary limitation — no riser block option exists for this model, making the capacity permanent|Steel frame rather than cast iron body means less mass and vibration dampening than comparable cast iron alternatives|Availability concerns — limited new stock at retail with buyers often competing with used market pricing|Table (15.75 x 18.875 inches) is adequate but smaller than the G0555LX and Rikon 10-326 at comparable prices","Accepts 93-1/2 inch blades, 1/8 to 3/4 inch wide; two-speed standard; 115/230V dual voltage; no riser block upgrade path — 6-inch resaw is a permanent ceiling on this model; standard 14-inch aftermarket blades from Timber Wolf and Lenox fit directly; Delta parts and service network available",https://www.acmetools.com/delta-14-in-1-hp-steel-frame-band-saw-28-400/847962004819.html,Acme Tools,1099.99,,,,,,,grizzly-g0555,Grizzly G0555 has the same cast iron table with a deeper upgrade ecosystem and riser block compatibility at a higher price.,jet-jwbs-14sfx,"The Jet JWBS-14SFX steps up to 1.75 HP and 13-inch resaw for buyers who need more than the Delta's fixed 6-inch resaw limit, at a higher price.",,,Live,6/11/2026,"Verified 2026-07-06: Acme Tools $1,099.99 valid product page, backordered (1-2 month lead, orderable). Amazon link dead — removed. Single retailer found."
grizzly-g0513x2,Grizzly G0513X2 17-Inch 2 HP Bandsaw,Grizzly,Band Saw,2008,7/6/2026,2,"Dual (110V/220V, prewired 220V)",131-1/2 inches,12,16.25,"23-5/8 x 17-1/4 inches, cast iron",325,4,Semi-Pro,"Woodworkers who have outgrown 14-inch saws and want production-grade 17-inch throat and 12-inch resaw capacity with a 2 HP motor, in a currently-produced model with full Grizzly parts support. Requires a dedicated 220V circuit and does not ship with a plug. Buyers who do not need beyond 14-inch capacity should stay with a G0555-class saw; those needing 5 HP continuous production should step up to an 18-inch machine.","Resaws wide dense hardwood (9-inch white oak, thin veneer) without motor bog-down | High fit and finish with precise, positive controls | Rack-and-pinion roller blade guides stay accurate through full travel | Strong quality-for-price versus competing 17-inch saws","Blade-tension and fence handle placement is awkward — you reach under the stock to adjust | Blade shroud makes guide and upper-bearing access difficult to set with a feeler gauge | No interlock on the tension lever, so the blade can pop off if started with tension released | Stock blade is poor quality and wide 1-inch blades are hard to install and remove",Accepts 131-1/2 inch blades 1/8 to 1 inch wide at 1700/3500 FPM. Two 4-inch dust ports accept standard hose. Cast-iron fence and miter gauge included; Grizzly sells model-specific replacement and resaw blades. A foot-brake variant (G0513X2BF) is available. Prewired 220V; no plug included.,https://www.grizzly.com/products/grizzly-17-2-hp-bandsaw-w-cast-iron-trunnion/g0513x2,Grizzly,1850,,,,,,,powermatic-pm1500b,The Powermatic PM1500B offers 15-inch capacity with 3 HP and premium cast-iron build at more than double the price.,grizzly-g0555,The Grizzly G0555 is a 14-inch 1 HP saw at under half the price for lighter resawing needs.,laguna-14bx,The Laguna 14BX is a 14-inch saw with a disc brake and ceramic guides at a higher price for buyers who prioritize those features over throat capacity.,Live,7/6/2026,"New entry 7/6/2026 as the current-production successor to the discontinued G0513ANV anniversary edition. grizzly.com $1,850 verified in stock. Net weight not published (shipping weight 421 lbs). Requires 220V dedicated circuit. Verify community/owner data before moving to Live."
jet-jwbs-14cs,Jet JWBS-14CS 14-Inch Closed Stand Bandsaw,Jet,Band Saw,2018,7/6/2026,1,Dual (115/230V),93-1/2 inches,6,13.5,"15 x 15 inches, cast iron",185,4,Serious Hobbyist,"Home-shop woodworkers who want a dependable, upgradeable traditional cast-iron 14-inch saw with Jet 5-year warranty and a closed storage stand at a moderate price. It handles general cutting and light resawing to 6 inches; add the riser block for taller stock. Buyers who resaw wide hardwood regularly should step up to the 1.75 HP JWBS-14SFX.","Proven traditional 14-inch design with long reported service life (10-plus years) | Easy near-assembled setup with single-knob tracking adjustment | 15 x 15 inch offset cast-iron table gives generous support in front of the blade | Clear Jet upgrade path — riser block, resaw fence, bearing guides, mobile base",1 HP is modest for heavy resawing and benefits from a riser block for taller stock | No fence included from the factory (separate accessory) | Polymer/nylon-bushing blade guides and the tensioner are common first upgrade targets | Dust collection under the lower wheel is mediocre and some units need wheel-balance tuning,"Accepts 93-1/2 inch blades 1/8 inch and wider at 3000 SFPM. 4-inch dust port. Jet OEM accessories: Riser Block Kit 708717 (extends resaw to ~12 inches), Deluxe Resaw Fence JRF-14N 714101, Carter-style bearing guides 708127, JMB-UMB mobile base 708118. Standard 14-inch aftermarket blades from Timber Wolf and Lenox fit.",https://www.rockler.com/jet-14-1hp-bandsaw-w-closed-stand,Rockler,1154,https://www.acmetools.com/jet-jwbs-14cs-14in-closed-stand-bandsaw-1hp-1ph-115-230v-708115k/662755123290.html,Acme Tools,,,,,jet-jwbs-14sfx,"The JWBS-14SFX steps up to a 1.75 HP steel frame, 13-inch resaw, and larger table for more demanding work at a higher price.",grizzly-g0555,The Grizzly G0555 is a comparable 1 HP 14-inch cast-iron saw at a lower price with a deep riser-block and parts ecosystem.,delta-28-400,"The Delta 28-400 is a two-speed 1 HP steel-frame 14-inch saw in the same class, though currently backordered.",Live,7/6/2026,"New entry 7/6/2026 as the budget/traditional Jet successor to the discontinued JWBS-14DXPRO. Rockler $1,154 verified in stock; Acme also carries it (price hidden until cart). Net weight 185 lbs per Jet spec. Fence not included from factory. Verify community data before Live."
grizzly-g0948,Grizzly G0948 10-Inch 1/2 HP Bandsaw,Grizzly,Band Saw,2022,7/6/2026,0.5,120V,72 inches,6.125,9.75,"14-3/16 x 12-5/8 inches, aluminum",75,4,Hobbyist,"Hobbyists who want surprising resaw capacity — 6-1/8 inches, rivaling some 14-inch saws — in a compact benchtop footprint, with two-speed control and an LED work light. Good for lumber prep, veneer resawing, curves, and small-shop use. Buyers who need a standard miter slot for aftermarket jigs, or who plan heavy daily hardwood resawing, should step up to a 14-inch floor saw.","Exceptional 6-1/8 inch resaw capacity for a 10-inch saw — rivals some 14-inch machines | Clean, accurate, stable cuts with ball-bearing blade guides | Two blade speeds (1520/2620 FPM) plus an LED work light | Strong value and compact footprint for small shops",Non-standard 8mm x 10mm miter slot blocks standard miter gauges and jigs | No quick-release blade tension lever | Cast-aluminum table and wheels feel less premium than cast iron | 1/2 HP universal motor is louder and less refined than an induction motor,Accepts 71-1/2 to 72-1/2 inch blades 1/8 to 1/2 inch wide (Grizzly sells matched replacement and resaw blades). Stepped dust port accepts up to a 4-inch hose. Two-position resaw fence and miter gauge included. Bear Crawl mobile base (T31566) available. No riser block (fixed frame).,https://www.grizzly.com/products/grizzly-10-1-2-hp-bandsaw/g0948,Grizzly,380,,,,,,,jet-jwbs-10os,"The Jet JWBS-10OS is a 10-inch saw with a brand-name warranty and 4-inch dust port, but only about 4-1/8 inches of resaw versus the G0948 6-1/8.",rikon-10-3061,"The Rikon 10-3061 is a 10-inch two-speed deluxe benchtop with a cast-iron table, but a smaller 5-inch resaw at a higher price.",grizzly-g0555,The Grizzly G0555 steps up to a full 14-inch floor saw with 1 HP and a cast-iron table for buyers ready to leave the benchtop class.,Live,7/6/2026,"New entry 7/6/2026. grizzly.com $380 on sale (list $425), in stock, 4.6/5 from 217 reviews — verified live via browser. Shipping weight 75 lbs (net not separately published). Non-standard 8mm x 10mm miter slot. Verify community data before Live."
grizzly-g0555xh,Grizzly G0555XH 14-Inch 1-3/4 HP Extreme Series Resaw Bandsaw,Grizzly,Band Saw,2018,7/6/2026,1.75,"Dual (110V/220V, prewired 110V)",105 inches,12,13.5,"16-1/8 x 21-3/4 inches, cast iron",334,4,Semi-Pro,"Serious hobbyists who want a full 12-inch resaw capacity in a 14-inch footprint without adding a riser block, powered by a 1-3/4 HP motor. The taller upper frame and cast-iron table suit frequent veneer and hardwood resawing. Buyers who only occasionally resaw, or who want the cheapest 14-inch entry, can save with the standard G0555; those needing a 17-inch-plus throat should look higher.","True 12-inch resaw capacity with no riser kit required | 1-3/4 HP handles hardwood resawing that bogs down 1 HP saws | Large 16 x 21-3/4 inch precision-ground cast-iron table | Quick-release tension, work light, and a closed cabinet with storage",Guide bearings wear and need periodic replacement | Cast-iron frame design can flex when tensioning wide (over 1/2 inch) resaw blades | Needs careful tuning and a quality blade to reach full potential | At 334 lbs it is heavy and awkward to reposition,Accepts 104 to 105 inch blades 1/4 to 3/4 inch wide at 1690/2950 FPM. 4-inch dust port. Two-position extruded-aluminum resaw fence and miter gauge included. Aftermarket guide bearings and carbide resaw blades fit; Grizzly Bear Crawl mobile base available.,https://www.grizzly.com/products/grizzly-14-1-3-4-hp-extreme-series-resaw-bandsaw/g0555xh,Grizzly,1695,,,,,,,grizzly-g0555,"The standard Grizzly G0555 is a 1 HP 14-inch saw at under half the price, but tops out at 6 inches of resaw without a riser block.",jet-jwbs-14sfx,"The Jet JWBS-14SFX offers a 1.75 HP steel frame and 13-inch resaw with a larger table at a comparable price, but a steel rather than cast-iron frame.",grizzly-g0513x2,"The Grizzly G0513X2 steps up to a 17-inch throat and 2 HP for buyers who need more width, at a higher price.",Live,7/6/2026,"New entry 7/6/2026. grizzly.com $1,695 plus $259 freight, in stock, 4.8/5 from 57 reviews — verified live via browser. The 12-inch resaw with no riser is the standout. Shipping weight 334 lbs. Verify community data before Live."
rikon-10-324tg,Rikon 10-324TG 14-Inch Open Stand Bandsaw,Rikon,Band Saw,2016,7/6/2026,1.5,Dual (115/230V),111 inches,13,13.63,"21-1/2 x 15-3/4 inches, cast iron",218,4,Semi-Pro,"Woodworkers who want Rikon most popular 14-inch saw — tool-less blade guides, a quick-release tension lever, 13-inch resaw, and a 5-year warranty — on an open stand with a storage shelf. A strong daily driver for a serious home shop. Buyers who want a heavier cast-iron-wheel build or a disc brake should compare the deluxe 10-326 or a Laguna.","Tool-less blade guide adjustment is fast and well-liked | Quiet, smooth, accurate cuts with 13-inch resaw capacity | Two blade speeds (1445/2950 FPM) for wood and non-ferrous work | 5-year warranty and strong community support",Fence can be fussy to set up | No miter gauge included | Cast-aluminum drive wheels are lighter than cast-iron-wheel competitors | Factory setup and guide alignment usually need fine-tuning,Accepts 111-inch blades 3/16 to 3/4 inch wide at two speeds. 4-inch dust port. 6-inch tall rip fence with resaw bar included. Tool-less guides accept standard replacements; Rikon mobile base 13-326 with adapter plate 13-324 available. Shares 111-inch blades with the 10-326.,https://www.woodcraft.com/products/rikon-14-open-stand-bandsaw-1-1-2-hp,Woodcraft,1199.99,,,,,,,rikon-10-326,The Rikon 10-326 deluxe adds a heavier build and larger handwheels at a higher price for buyers who want more mass.,jet-jwbs-14sfx,"The Jet JWBS-14SFX offers a 1.75 HP steel frame and larger table at a similar-to-higher price, but with single-speed operation.",grizzly-g0555xh,The Grizzly G0555XH matches a 12-inch resaw with a 1.75 HP motor and cast-iron table at a higher price.,Live,7/6/2026,"New entry 7/6/2026. Woodcraft $1,199.99 (Model 10-324TG, item 167677), in stock/ships from manufacturer — verified live via browser. Net weight not published on retailer page (~218 lbs per secondary sources — confirm). Rikon most popular 14-inch. Verify weight and community data before Live."
grizzly-g0514x2b,Grizzly G0514X2B 19-Inch 3 HP Extreme-Series Bandsaw w/ Motor Brake,Grizzly,Band Saw,2016,7/6/2026,3,220V,143 inches,12,18.25,"26-3/4 x 19 inches, cast iron",512,4,Professional,"Serious hobbyists and small-shop pros who want maximum wheel size and an 18-1/4 inch throat with a 3 HP motor and an electronic motor brake that stops the blade in about 3 seconds, at a value price. Requires a 220V circuit. Buyers who do not need 19-inch capacity can save with a 17-inch G0513X2; those wanting 16-inch resaw should look at an 18-inch premium saw.","Electronic motor brake stops the blade in about 3 seconds | Ample 3 HP power and stable, vibration-damped cuts | Excellent value — often 1,000 to 2,000 dollars less than comparable saws | Resaws fine veneer and thick hardwood with dual ball-bearing guides",Some owners report vibration at higher speeds on individual units | At 512 lbs it is heavy and awkward to move | Only a 1-year warranty | Import-machine fit-and-finish can vary and benefit from tuning,Accepts 143-inch blades 1/8 to 1-1/4 inch wide at 1700/3500 FPM. Dual 4-inch dust ports. Deluxe cast-iron fence with extruded-aluminum resaw fence and heavy-duty miter gauge included. Accepts aftermarket ceramic/Carter guides and carbide resaw blades; Bear Crawl mobile base available.,https://www.grizzly.com/products/grizzly-19-3-hp-extreme-series-bandsaw-w-motor-brake/g0514x2b,Grizzly,2675,,,,,,,grizzly-g0513x2,The Grizzly G0513X2 is a 17-inch 2 HP saw at a lower price for buyers who do not need 19-inch capacity or a motor brake.,powermatic-pm1800b,The Powermatic PM1800B is an 18-inch 5 HP professional saw with 18-inch resaw at a much higher price and premium build.,laguna-18bx,"The Laguna 18BX is an 18-inch 3 HP saw with 16-inch resaw, ceramic guides, and a disc brake at a higher price.",Live,7/6/2026,"New entry 7/6/2026. grizzly.com $2,675, orderable (backordered), 4.7/5 from 44 reviews — verified live via browser. Requires 220V dedicated circuit. Shipping weight 512 lbs. Verify community data before Live."
laguna-18bx,Laguna 18|BX 18-Inch 3 HP Bandsaw,Laguna,Band Saw,2017,7/6/2026,3,220V,145 inches,16,18,"20 x 26 inches, cast iron",410,4,Professional,"Serious woodworkers who want a premium 18-inch saw with 16-inch resaw height, Laguna ceramic guides, a disc brake, and 1-1/4 inch blade capacity for large hardwood slabs and veneers. Buyers who resaw wide stock often and value ceramic guides and a fast-stopping brake. Those who need less capacity can save with the 14BX or 14|12; a Grizzly 19-inch offers more throat for less money.",16-inch resaw and 1-1/4 inch blade capacity handle large hardwood slabs | Laguna ceramic guides run cool and hold position in sustained resawing | Disc brake stops large blades quickly | Arrives well packaged and tunes up to excellent cut quality,"Documented QC variance on some units (table flatness, trunnion ways) | Mixed reports on Laguna customer service | Shipping and accessory costs add up | At 410 lbs it needs a mobile base and is hard to reposition",Accepts 145-inch blades up to 1-1/4 inch wide. Dual 4-inch dust ports. Laguna Resaw King carbide blade and DXIII DriftMaster fence (both at Rockler) are common upgrades; ceramic guide inserts are replaceable; a mobile base is recommended.,https://www.rockler.com/laguna-18-bx-bandsaw220v,Rockler,3299,,,,,,,laguna-14bx,The Laguna 14BX is the 14-inch version with the same ceramic guides and disc brake at a much lower price and 13-inch resaw.,grizzly-g0514x2b,"The Grizzly G0514X2B is a 19-inch 3 HP saw with a wider throat and motor brake at a lower price, but with steel guides instead of ceramic.",powermatic-pm1800b,The Powermatic PM1800B is an 18-inch 5 HP saw with more power and 18-inch resaw at a higher price.,Live,7/6/2026,"New entry 7/6/2026. Rockler $3,299 (item 54757), in stock — verified live via browser. Also carried at Woodcraft and Advanced Machinery. Net weight ~410 lbs (460 shipping). Some documented QC variance. Verify additional specs/community data before Live."
ryobi-rts12,RYOBI 15 Amp 10 in. Table Saw with Folding Stand (RTS12),Ryobi,Table Saw,2020,7/6/2026,,120V,,,,,51,2.5,Weekend Warrior,"This is a good first saw for someone setting up a garage shop on a tight budget or a homeowner who needs to rip a few boards and break down plywood now and then. It handles construction lumber and light furniture stock without complaint. If you plan to do fine joinery or want dead-accurate repeat cuts all day, you will outgrow it.",Cheap enough to buy without much thought | Light and easy to move around a one-car garage | Folding stand is quick to open and put away | Plenty of power for 2x material and plywood,Fence needs checking and sometimes shimming for square rips | Miter gauge feels loose and cheap | 12 inch right rip limits wide sheet cuts | Dust pickup is weak even with a shop vac attached,"Takes any standard 10-inch, 5/8-inch arbor blade, so a decent 40-tooth combo blade is the first worthwhile change. It does not accept a dado stack. The fence and stand are not really upgradeable, so plan to add an outfeed table or a simple shop-built crosscut sled if you want cleaner results.",https://www.homedepot.com/p/RYOBI-15-Amp-10-in-Compact-Portable-Corded-Jobsite-Table-Saw-with-Folding-Stand-RTS12/309412842,Home Depot,229,,,,,,,ryobi-rts08,The RTS08 is a smaller 8-1/4 inch compact without a stand at a lower price.,dewalt-dwe7491rs,The DeWalt DWE7491RS steps up to a rack-and-pinion fence and rolling stand for more accuracy.,bosch-4100xc-10,The Bosch 4100XC adds a gravity-rise stand and smoother cuts at a higher price.,Live,,New 7/6/2026. Price $229 VERIFIED on Home Depot page. Big-box retailer (not a preferred woodworking affiliate); Home Depot is monetizable via the site Impact tag. HP not published (15A). Community substantive.
